{
  "manual_observation_fixture": {
    "id": "GRAPHICS-MANUAL-OBSERVATION-SUPRA-2JZ-GTE-0001",
    "version": "v1",
    "domain": "graphics_validation",
    "status": "fixture_only",
    "observation_mode": "manual_human_review_fixture",
    "recorded_at": "2026-07-08T00:00:00Z"
  },
  "candidate_binding": {
    "candidate_manifest_id": "GRAPHICS-CANDIDATE-MANIFEST-SUPRA-2JZ-GTE-0001",
    "candidate_id": "GRAPHICS-CANDIDATE-SUPRA-2JZ-GTE-0001",
    "candidate_manifest_key": "supra_2jz_gte",
    "contract_key": "supra_2jz_gte_twin_turbo",
    "candidate_reference_status": "reference_only_not_loaded"
  },
  "observation_boundary": {
    "source_type": "manual_human_review",
    "real_image_ingestion_ran": false,
    "computer_vision_ran": false,
    "ocr_ran": false,
    "image_generation_ran": false,
    "image_editing_ran": false,
    "approval_automation_ran": false
  },
  "observations": [
    {
      "observation_id": "OBS-SUPRA-IDENTITY-0001",
      "constraint_id": "supra_2jz_gte.subject_identity",
      "constraint_group": "subject_identity",
      "source_type": "manual_human_review",
      "claim": "Candidate should remain Toyota Supra Mk IV / A80 Turbo.",
      "observed_status": "not_observed",
      "confidence": 0,
      "reviewer_or_agent": "manual_fixture_placeholder",
      "notes": "No real image was loaded for this fixture."
    },
    {
      "observation_id": "OBS-SUPRA-GEOMETRY-0001",
      "constraint_id": "supra_2jz_gte.geometry.inline_six",
      "constraint_group": "geometry",
      "source_type": "manual_human_review",
      "claim": "Candidate should preserve 2JZ-GTE inline-six engine layout.",
      "observed_status": "not_observed",
      "confidence": 0,
      "reviewer_or_agent": "manual_fixture_placeholder",
      "notes": "No real image was loaded for this fixture."
    },
    {
      "observation_id": "OBS-SUPRA-TURBO-0001",
      "constraint_id": "supra_2jz_gte.component_location.sequential_turbos",
      "constraint_group": "component_location",
      "source_type": "manual_human_review",
      "claim": "Candidate should preserve sequential twin turbocharger relationship.",
      "observed_status": "not_observed",
      "confidence": 0,
      "reviewer_or_agent": "manual_fixture_placeholder",
      "notes": "No real image was loaded for this fixture."
    }
  ],
  "observation_summary": {
    "total_observations": 3,
    "satisfied_count": 0,
    "missing_count": 0,
    "ambiguous_count": 0,
    "contradicted_count": 0,
    "not_observed_count": 3,
    "lowest_confidence": 0,
    "overall_observation_status": "needs_review"
  },
  "recommendation": {
    "recommended_decision": "needs_review",
    "reason": "Manual observation fixture did not inspect a real image, so approval remains disallowed.",
    "approval_allowed": false,
    "uncertainty_default": "needs_review",
    "manual_observations_can_approve_alone": false
  }
}
